{
  "trace_id": "8f3a1c2e4b5d6a7f8f3a1c2e4b5d6a7f",
  "span_id": "b2c3d4e5f6071829", "parent_span_id": "a1b2c3d4e5f60718",
  "layer": "http", "event_type": "http_request", "name": "POST /api/document",
  "kind": "request", "language": null,
  "source": { "file": "static/js/document.js", "line": 145, "symbol": "fetch" },
  "start_time_unix_ns": 1759145553489000000, "duration_ms": 42.1, "status": "ok",
  "confidence": 1.0, "correlation": { "method": "trace_id", "score": 1.0, "reason": null },
  "attributes": {
    "http": { "method": "POST", "url": "https://t/api/document", "status": 200,
              "req_bytes": 512, "res_bytes": 1284, "resource_type": "fetch",
              "from_cache": false, "redirects": 0 },
    "initiator": { "file": "static/js/document.js", "line": 145, "function": "submitDocument",
                   "type": "fetch", "stack": ["submitDocument@142:7"] },
    "preflight": { "observed": true, "allowed": true }
  },
  "clock_offset_ms": 0.0,
  "collector": { "name": "playwright-adapter", "version": "0.1.0", "run_id": "run-20260929-101233" }
}
